,Key_a,title_a,brand_a,price_a,Key_b,title_b,brand_b,price_b,label
987,"[153677, 380181, 28018395, 1726605, 1582702, 1535570, 253509, 6911149, 23542267]",air more uptempo kixpress com nike 414962 103,nike,142 95 78 95 76 95 269 95 87 95,"[2714583, 2710147, 2410591, 971195, 518688, 5185697, 1140085, 2939655, 3520457]",nike wmns air max 90 essential white light brown crimson 616730 113 bludshop com,,,0
988,"[3747883, 3576931, 2458285, 976243, 7403823, 17660, 212415, 2303668, 763207]",cheap nike air more uptempo og white gum 414962 103 for sale jordan 11 legend blue,,,"[3177775, 3651374, 504409, 21427136, 20965621, 4920224, 2905296, 880040, 515416]",sneakers buty nike air max 90 ultra essential white cool grey infrared black 819474 106 bludshop com,,,0
989,"[153362, 14664875, 847, 246514, 4677814, 3534960, 1246411, 604394, 2060792]",tennis classic nike 312498 130 everysize com,nike,,"[2261408, 2260902, 2261418, 724698, 663601, 2702745, 55081, 444309, 240843]",air max 90 ultra essential,,87 00 eur,0
990,"[153362, 1246411, 3534957, 604394, 3534960, 14664875, 847, 2623190, 2060792]",nike wmns tennis classic white black 312498 130 purchaze,nike,,"[311842, 378923, 2837811, 129333, 386117, 6735651]",nike wmns benassi jdi black white 343881 011 bludshop com,,,0
991,"[153362, 14664875, 847, 246514, 4677814, 3534960, 1246411, 604394, 2060792]",tennis classic nike 312498 130 everysize com,nike,,"[5089308, 64653347, 724698, 663601, 444309, 2702745, 56599233, 240843, 6794674]",wmns air max bw ultra nike 819638 001 everysize com,nike,,0
992,"[2576418, 18401829, 2635791, 2467627, 15295479, 45650, 618531, 3087281, 62113462]",nike free train versatility black white mens shoes,,,"[7133674, 3837891, 61993138, 4849769, 61992968, 57273218, 66739758, 66739748, 7264772]",nike zoom winflo 3 azul negro blanco zapatillas para hombre,,,0
993,"[870, 2200792, 531856, 8779256, 16965832, 956740, 1163081, 228293, 17003687]",nike free train versatility nero bianco scarpe uomo,,,"[2905902, 22690274, 64399087, 3186821, 583, 2581918, 847683, 18087837, 63711092]",nike free trainer 3 0 v4 noir vert solaire blanc chaussures pour homme,,,0
994,"[2576418, 3087281, 69562202, 2635791, 2467627, 15295479, 45650, 65807972, 67435090]",nike free train versatility nero bianco scarpe uomo,,,"[4936804, 5156478, 69920812, 56695783, 923895, 1370832, 21014429, 24053301, 2083258]",nike zoom train complete nero antracide bianco scarpe uomo training regolare,,,0
995,"[785459, 63346621, 1425082, 407275, 4698259, 4697875, 741723, 11223, 406919]",wmns air force 1 hi se nike 860544 002 everysize com,nike,,"[2026422, 7848421, 203388, 50403993, 3352544, 26571, 2062601, 19852, 589203]",wmns roshe one nike 844994 002 everysize com,nike,,0
996,"[4683055, 11654615, 64638148, 11427125, 63339370, 17006756, 64359753, 16484120, 967015]",nike wmns air force 1 hi se czarny 369 99 pln lifestyle 860544002 up8 com,nike,,"[1191288, 65389639]",air force 1 mid 07,,54 50 eur,0
997,"[4683055, 11654615, 64638148, 11427125, 63339370, 17006756, 64359753, 16484120, 967015]",nike wmns air force 1 hi se czarny 369 99 pln lifestyle 860544002 up8 com,nike,,"[64150233, 3264361, 3206468, 6117237, 837214, 17079909, 3040383, 244878, 6692959]",nike wmns air force 1 low upstep br white 833123 100 bludshop com,,,0
998,"[7959867, 7365701, 10540954, 12755099, 465053, 16232079, 20128284, 55520012]",asics gel noosa tri 11 t676q 9090 footstop,,,"[660030, 2539328, 6817333, 1525756, 3213978, 3213979, 2891031, 62110401, 65475060]",nike air zoom structure 19 white black electric green concord mens shoes,,,0
999,"[483915, 165023, 60517466, 142794, 3341498, 5262520, 7034804, 90007, 4093664]",nike mercurial veloce iii neymar jr fg azul blanco marino botas de futbol,,,"[4004122, 50412595, 4003579, 209783, 4004126, 3967428, 54591, 23817385, 54568]",concave quantum fg bianco rosa scarpe uomo terreni compatti,,,0
1000,"[483915, 165023, 60517466, 142794, 3341498, 5262520, 7034804, 90007, 4093664]",nike mercurial veloce iii neymar jr fg azul blanco marino botas de futbol,,,"[3412968, 6179438, 17133430, 50817870, 2892548, 230506, 2280945, 13361589, 944]",concave quantum fg wit limoen heren voetbalschoenen ferme grond,,,0
1001,"[483915, 165023, 60517466, 142794, 3341498, 5262520, 7034804, 90007, 4093664]",nike mercurial veloce iii neymar jr fg azul blanco marino botas de futbol,,,"[23647131, 217559, 660030, 16590705, 7119408, 7087188, 579455, 17479171, 3905223]",concave quantum fg white pink mens soccer cleats firm ground,,,0
1002,"[52303067, 52302954, 52303131, 52303081, 52303168, 52303186, 52303013, 52303000, 52302985]",puma esito classico fg negro blanco bronce botas de futbol 10333601,,,"[4004110, 3967428, 3818168, 4004122, 4004126, 209783, 129437, 54568, 23817385]",puma evotouch pro fg nero bianco giallo safety scarpe uomo terreni compatti,,,0
1003,"[1313999, 1988471, 499616, 47774, 8524, 2019450, 2080005, 1362126, 244750]",puma esito classico fg noir blanc bronze chaussures de football terrain sec crampons 10333601,,,"[52303067, 52302954, 52303131, 52303081, 52303168, 52303186, 52303013, 52302975, 52303000]",puma esito classico sg negro blanco bronce botas de futbol 10333301,,,0
1004,"[52303067, 52302954, 52303131, 52303081, 52303168, 52303186, 52303013, 52303000, 52302985]",puma esito classico fg negro blanco bronce botas de futbol 10333601,,,"[52303067, 52302954, 52303131, 52303081, 52303168, 52303186, 52303013, 52303000, 52302985]",puma esito classico sg negro blanco bronce botas de futbol 10333301,,,0
1005,"[970101, 4839884, 1415817, 2529207, 5156478, 2823774, 646426, 13743255, 764998]",concave kids volt fg black gold junior soccer cleats firm ground,,,"[325718, 16255655, 491678, 3197039, 45043966, 47774, 499616, 664234, 16325252]",puma king enfant top i fg noir blanc or chaussures de football 10246601,,,0
1006,"[14525387, 5458339, 6464012, 2735642, 11682387, 6463126, 7103692, 6003586, 6465973]",concave junior volt fg nero oro scarpe terreni compatti,,,"[27230377, 532200, 56736359, 11321408, 3483118, 16457556, 11321409, 3144100, 196255]",nike junior hypervenom phantom ii fg volt nero hyper turchese scarpe terreni compatti,,,0
1007,"[14525387, 5458339, 6464012, 2735642, 11682387, 6463126, 7103692, 6003586, 6465973]",concave junior volt fg nero oro scarpe terreni compatti,,,"[4004110, 4004126, 4004122, 483915, 165023, 60517466, 3341498, 1990127, 4093664]",nike junior hypervenom phelon ii fg nero volt scarpe uomo terreni compatti,,,0
1008,"[785459, 407184, 1425082, 56013, 820827, 1519024, 63346621, 5452271, 580556]",air force 1 mid 07,,109 00 eur,"[785459, 407184, 1425082, 56013, 820827, 1519024, 63346621, 5452271, 580556]",air force 1 mid 07,,54 50 eur,0
1009,"[6794674, 21659252, 6795141, 6794726, 56599233, 669014, 960854, 3251928, 18631608]",nike air max 1 premium sc team red 918354 600 sneakavenue,,,"[1759482, 25539768, 847802, 4003728, 492148, 109021, 3926679, 3024364, 5263932]",nike air huarache run premium desert moss 704830 302 sneakavenue,,,0
1010,"[63833250, 62110401, 21986520, 21130464, 63335211, 64352179, 65475060, 66400122, 57078255]",nike womens air zoom structure 19 cp white volt black shoes,,,"[66216, 18668246, 8029836, 6865038, 4039697, 579284, 346946, 15074184, 1166152]",nike womens air zoom fit 2 black white dark grey wolf shoes,,,0
1011,"[2415656, 886286, 30315607, 576673, 161192, 431942, 369086, 2708114, 4220731]",nike wmns air max thea schwarz grau anthrazit weiss 599409 007 purchaze,nike,,"[3596407, 64656579]",nike air max bw schwarz weiss 881981 002 purchaze,nike,,0
1012,"[2415656, 886286, 30315607, 4220731, 3990167, 2415569, 16227993, 2415575, 17031641]","""Nike WMNS Air Max Thea (599409-007)""@de",,,"[483915, 165023, 60517466, 90007, 1990165, 4093664, 7034804, 5262520, 1990127]",nike air max 90 essential schwarz weiss 537384 077 purchaze,nike,,0
1013,"[2415656, 886286, 30315607, 576673, 161192, 431942, 369086, 2708114, 4220731]",nike wmns air max thea schwarz grau anthrazit weiss 599409 007 purchaze,nike,,"[967015, 9324638, 167778, 2463075, 1869935, 68287013, 2154207, 1528511, 56209156]",nike air max 90 essential czarny 499 99 pln sneakersy 537384077,nike,,0
1014,"[1154327, 1206683, 390595, 2155150, 59925194, 2984305, 181952, 2481187, 133121]",basketball shoes air jordan xiii retro 4815 shop basketmania,,,"[49041618, 246970, 3461256, 133279, 2216078, 5283, 716928, 3543450, 4839180]",funkita diamond back tiptonic swiminn,funkita,,0
1015,"[580220, 4451202, 486963, 2468432, 1969134, 6928607, 14594724, 579353, 736801]",air jordan 13 retro bred black varsity red white for sale online new jordans 2015,,,"[1130577, 1129480, 3944952, 3225873, 4140943, 30749736, 6675972, 28249, 490441]",air jordans 11 retro low white black concord for sale 2017 jordan shoes,,,0
1016,"[1154327, 1206683, 390595, 2155150, 21130730, 181952, 2984305, 2481187, 133121]",cheap air jordan 13 xiii retro bred black varsity red white for sale,,,"[1130577, 1129480, 3944952, 3225873, 4140943, 30749736, 6675972, 28249, 490441]",air jordans 11 retro low white black concord for sale 2017 jordan shoes,,,0
1017,"[23444, 16202837, 16201043, 275326, 22073261, 1000642, 24951302, 59977145, 3221140]",nike air max 97 summit white 921826 100 sneakavenue,,,"[5089308, 64653347, 696278, 679172, 52303152, 52303263, 66740887, 52303143, 66738691]",air max 2016 nike 806771 001 everysize com,nike,,0
1018,"[1466199, 27230377, 4992154, 42408008, 532200, 11321408, 460235, 56736359, 11321409]",buty nike magista opus fg czarny zielony hyper szkar at pi karskie korki twarde pod o e trawa naturalna lanki 649230 003,,,"[2678899, 67091030, 660030, 4279276, 6413943, 2667715, 4944043, 3177775, 1134648]",nike hypervenom phatal ii df ltr fg black total orange mens boots firm ground,,,0
1019,"[1466199, 532200, 4992154, 27230377, 42408008, 20181684, 11321408, 56736359, 18667331]",nike magista opus fg noir vert hyper rouge chaussures de football terrain sec,,,"[1671888, 5004784, 668695, 15930925, 4303906, 18634981, 1149669, 4140606, 2533337]",buty nike junior mercurial victory v fg szkar atny perski fiolet czarny dzieci ce pi karskie korki intense heat twarde pod o e trawa naturalna lanki 651634 650,,,0
1020,"[1543, 129437, 3818168, 459794, 8633, 3927625, 8615, 66740727, 3754656]",nike magista opus fg nero verde cremise hyper scarpe da calcio terreni compatti,,,"[47774, 1313999, 1988471, 175145, 2019450, 2721014, 8524, 1081491, 28064678]",nike hypervenom phatal ii df cuir fg noir orange total chaussures de football homme terrain sec,,,0
1021,"[588352, 223359, 52063378, 17029422, 59826388, 49857443, 3429456, 66740726, 66741247]",nike magista obra ii fg rio volt obsidiana jade claro botas de futbol,,,"[2479601, 3505469, 3549732, 3594822, 2000400, 1952952, 727219, 3225241, 3225240]",nike hypervenom phelon ii fg volt noir hyper turquoise chaussures pour homme terrain sec,,,0
1022,"[11387402, 588352, 223359, 52063378, 17029422, 2429447, 889386, 515013, 5585416]",nike magista obra ii fg rio teal volt ossidiana giada clear scarpe uomo firm ground obsidian jade,,,"[3549732, 3505469, 3594822, 2000400, 1952952, 18343261, 728707, 3225241, 3225240]",nike hypervenom phelon ii fg noir volt chaussures pour homme terrain sec,,,0
1023,"[16995784, 18343261, 3399398, 2947078, 4205446, 4932832, 3577221, 1708504, 484234]",nike magista obra ii fg turquoise rio volt obsidienne jade chaussures de football homme terrain sec i pro direct soccer,,,"[26110155, 19059388, 20730338, 16915787, 686095, 11993313, 3672746, 15130358, 7082901]",nike jr magista ola ii fg soccer shoes colour green 844204 374 athletic footwear apparel and sports equipment,nike,,0
1024,"[68287013, 2154207, 1528511, 56209156, 65471470, 37155, 65544185, 64043156, 64041768]",nike air max 90 essential m skie darmowa dostawa do domu sklep sizeer,,,[64722574],nike air max 90 mesh bg damskie m skie i dzieci ce darmowa dostawa sizeer,,,0
1025,"[68287013, 2154207, 65471470, 64043156, 65544185, 64041768, 64048364, 63062867, 56209156]",nike air max 90 essential nowo ci 2017 sklep sizeer,,,"[724698, 663601, 55081, 2702745, 240843, 444309, 264048, 16354845, 1028599]",nike air max 90 ultra 2 0 ltr znane marki ubra i but w m skich darmowa dostawa do domu sizeer,,,0
1026,"[6794674, 669014, 6794726, 56599233, 18028904, 16422172, 1475581, 18152555, 12326461]",nike air max 90 essential damskie m skie i dzieci ce darmowa dostawa sizeer,,,"[27217352, 42350513, 12894596, 30241562, 29266998, 27892155, 30612609, 28871809, 28042651]",nike air vibenna prem nowo ci 2017 sklep sizeer,,,0
1027,"[16992370, 1109340, 3229375, 28856174, 1440832, 24259081, 24259052, 30007492, 50192889]",gel fortitude 7 women hardloopschoenen voor dames asics,,,"[1130577, 1630764, 4140943, 5187395, 1129480, 6008832, 5378927, 7882040, 22903403]",gel nimbus 19 para mujer women s road running shoes asics,,,0
1028,"[3040408, 14207952, 3051450, 1216153, 27480997, 8031301, 2980145, 28495518, 3236344]",gel fortitude 7 women chaussures de course pied pour femmes asics,,,"[4636099, 679172, 52303067, 696278, 66740887, 52303263, 42713992, 61993053, 53071923]",asics gel cumulus 19 niebieski 399 99 pln running t7b8n4890 up8 com,asics,,0
1029,"[27480997, 23005628, 20311446, 57277508, 41955488, 55984341, 22079749, 17621653, 3051450]",gel fortitude 7 women scarpe da running per donna asics,,,"[16670252, 1151314, 16303545, 548924, 1982436, 3766184, 3236372, 3233233, 2882090]",nitrofuze men chaussures de course pied pour hommes asics,,,0
1030,"[3922584, 3718481, 164766, 3964306, 1495530, 15961989, 4004126, 3596941, 4004110]",nitrofuze men scarpe da running per uomo asics,,,"[430080, 3106145, 3675506, 4710462, 1324019, 117014, 7794753, 63400729, 65316751]",gel excite 4 men herren laufschuhe asics,,,0
1031,"[16670252, 1151314, 16303545, 548924, 1982436, 3766184, 3236372, 3233233, 2882090]",nitrofuze men chaussures de course pied pour hommes asics,,,"[64582826, 29819092, 4923681, 3429263, 2905630, 881024, 16765311, 7733816, 12127209]",gel blade 5 men squash badmintonschoenen voor heren asics,,,0
1032,"[3922584, 3718481, 164766, 3964306, 1495530, 15961989, 4004126, 3596941, 4004110]",nitrofuze men scarpe da running per uomo asics,,,"[4635634, 1653284, 63318475, 48263, 11617752, 6157339, 1130577, 1129480, 4140943]",asics gel quantum 360 knit white snow silver mens shoes t728n 0100,,,0
1033,"[650043, 483378, 47543062, 1544006, 1622405, 7642409, 1982924, 858508, 16167586]",shoes air jordan i retro high gs 9378 sale basketball shop basketmania,,,"[483915, 165023, 60517466, 7034804, 3341498, 90007, 448969, 1990165, 4093664]",air 1 mid nike jordan 554724 110 everysize com,nike jordan,,0
1034,"[1982924, 858508, 16167586, 3388502, 5755476, 47543062, 1544006, 7642409, 5917759]",air 1 retro high gg nike jordan 332148 405 everysize com,nike jordan,,"[3177775, 2250446, 6343500, 4920238, 56241211, 504409, 21427136, 20965621, 4920224]",air jordan 10 retro steel white black light grey varsity red 2013 release hoop,,,0
1035,"[650043, 483378, 47543062, 1544006, 1622405, 7642409, 1982924, 858508, 16167586]",shoes air jordan i retro high gs 9378 sale basketball shop basketmania,,,"[27217352, 23641878, 1479, 42350513, 29317221, 24326087, 28858979, 27827682, 28871809]",2017 air jordan 12 bordeaux men s shoes 130690 617 for sale retro,,,0
1036,"[4004126, 3967428, 4004122, 3818168, 4004110, 129437, 3992639, 54591, 23817385]",concave quantum 1 0 sg nero bianco scarpe uomo terreni morbidi,,,"[3549732, 2905902, 2000400, 1952952, 727219, 728707, 3505469, 3594822, 18343261]",concave quantum fg blanc noir chaussures pour homme terrain sec,,,0
1037,"[6179438, 17133430, 3412968, 50817870, 829535, 181540, 230506, 2892548, 13361589]",concave quantum 1 0 sg noir blanc chaussures pour homme terrain gras,,,"[28551243, 25250, 4660942, 55229798, 56736133]",concave volt sg argent bleu chaussures pour homme terrain gras,,,0
1038,"[967015, 9324638, 167778, 2463075, 1869935]",buty concave quantum 1 0 sg czarny bia y m skie pi karskie mi kka nawierzchnia wkr ty,,,[2494397],buty concave quantum 1 0 fg bia y limonka m skie pi karskie trawa naturalna,,,0
1039,"[1134648, 1087121, 754766, 580973, 13191, 3355041, 1431486, 491350, 187796]",nike mercurial victory v fg enfant blanc noir volt orange total chaussures pour terrain sec,,,"[4004110, 4004126, 4004122, 3818168, 1929539, 129437, 129265, 3754656, 332524]",nike junior hypervenom phelon ii fg nero volt scarpe uomo terreni compatti,,,0
1040,"[580220, 483919, 7830524, 1402755, 2709024, 486963, 579353, 51931822, 1199657]",nike jr mercurial victory fg kind fu ballschuhe nocken farbe wei 651634 107 der online shop f r deine sportbekleidung,nike,,"[27230377, 532200, 56736359, 11321408, 3483118, 16457556, 11321409, 3144100, 196255]",nike junior hypervenom phantom ii fg volt nero hyper turchese scarpe terreni compatti,,,0
1041,"[1130577, 30749736, 2913554, 933437, 1129480, 4140943, 16202837, 16201043, 2529207]",nike jr mercurial victory fg soccer shoes colour white 651634 107 athletic footwear apparel and sports equipment,nike,,"[28551243, 25250, 42906243, 9198364, 15199106, 50682532, 950355, 3276915, 6517221]",nike tiempo legacy fg anthracite black volt mens boots firm ground,,,0
1042,"[26350957, 1345751, 19961803, 12109062, 886671, 261620, 2420335, 2152077, 844382]",puma bog sock core high risk red 362038 03 bludshop com,,,"[1078818, 826255, 2359049, 529366, 47908718, 43398959, 2497571, 962552, 38066788]",puma suede classic zwart heren schoenen trainers sportschoenen,,,0
1043,"[3341498, 483915, 165023, 60517466, 5262520, 90007, 7034804, 1990127, 1990165]",nike tiempo legend sg pro antracide nero volt scarpe uomo terreni morbidi,,,"[4003579, 50412595, 3283879, 18127602, 3282190, 6466355, 3795947, 5427719, 4269274]",concave volt sg nero rosa scarpe uomo terreni morbidi,,,0
1044,"[2000400, 1952952, 3549732, 727219, 3594822, 3225241, 3225240, 728707, 3505469]",nike tiempo legend sg pro anthracite noir volt chaussures pour homme terrain gras,,,"[3429456, 588352, 223359, 52063378, 17029422, 3818168, 3754656, 129437, 59826388]",nike tiempo rio iii sg giada clear nero volt scarpe uomo terreni morbidi,,,0
1045,"[3177775, 59977145, 3651374, 1635046, 10942435, 504409, 21427136, 20965621, 4920224]",nike tiempo legend sg pro anthracite black volt soccer cleats soft ground,,,"[15111541, 7180534, 4297094, 3815697, 570180, 2291188, 2206176, 20856118, 3285763]",nike hypervenom phantom sg pro volt persian violet hot lava black soccer cleats soft ground,,,0
1046,"[3829295, 4226269, 6510440, 743057, 3996049, 1671179, 7791767, 2580219, 3521552]",puma evospeed ii sl leather tricks fg pink glo safety yellow black mens shoes firm ground,,,"[1638134, 3157376, 771202, 6464413, 6301035, 6848391, 5550132, 78402]",puma evospeed 3 5 piel fg blanco negro naranja botas de futbol terrenos firmes,,,0
1047,"[6510440, 3829295, 4226269, 3521552, 1142900, 1671179, 903983, 743057, 3996049]",puma evospeed sl ii leather tricks fg the soccer factory,,,"[1929539, 1498968, 129265, 332524, 1479583, 239693, 6715760, 6166327, 3002103]",puma junior evospeed 5 tricks fg rosa glo giallo safety nero scarpe terreni compatti,,,0
1048,"[6510440, 3829295, 4226269, 3521552, 1142900, 1671179, 903983, 743057, 3996049]",puma evospeed sl ii leather tricks fg the soccer factory,,,"[3197039, 16255655, 491678, 325718, 6412219, 3439813, 3822607, 638253, 1241467]",puma king ii fg the soccer factory,,,0
1049,"[2544069, 868531, 56736354, 38428702, 1764329, 7919383, 889516, 5152196, 7400425]",keen alamosa chocolate brown bronze green it,,,"[59977145, 214113, 16248744, 6276389, 170064, 16212224, 1635046, 19655096, 21984962]",2016 air jordan 9 retro copper statue white black militia green for sale new jordans,,,0
1050,"[2544069, 38428702, 868531, 56736354, 889516, 7919383, 1638167, 266436, 5152196]",keen alamosa chocolate brown bronze green ie,,,"[30749736, 1129480, 16590705, 1130577, 4140943, 5187395, 3944952, 6675972, 23647131]",nike air zoom pegasus 33 women s training shoes white pink green footwear,goaliemonkey,93 98 usd,0
1051,"[2544069, 38428702, 868531, 56736354, 889516, 7919383, 1638167, 266436, 5152196]",keen alamosa chocolate brown bronze green ie,,,"[16590705, 65798425, 162797, 8864, 407275, 63346621, 7756499, 23647131, 217559]",nike air zoom pegasus 33 women s training shoes white pink green running and,baseball monkey,93 98 usd,0
1052,"[1498968, 1362126, 2906521, 332524, 6166327, 8524, 1081491, 28064678, 5465894]",puma evospeed 4 2 ag junior bleu p che chaussure de football terrain artificiel enfant peche,,,"[3594822, 3549732, 6850731, 10707933, 2905902, 727219, 728707, 3505469, 3225241]",puma evospeed 5 fg enfant noir blanc rouge chaussures pour terrain sec,,,0
1053,"[2678899, 4279276, 623765, 7378145, 7378192, 67091030, 7378348, 178943, 6413943]",puma evospeed 4 2 ag junior blue peach rugby boots artificial ground sharks fluro,,,"[61694563, 16186459, 27825886, 4967433, 506696, 7767357, 2009192, 4967481, 4967452]",buty puma evopower 4 2 fg jr peacoat bia y bright plasma korki dzieci ce pi karskie twarde pod o e trawa naturalna lanki 10322801,,,0
1054,"[17493275, 2628556, 157064, 12257149, 794586, 1069901, 62096824, 1543, 1929539]",puma junior evospeed 4 2 ag blu pesca scarpe da calcio erba artificiale,,,"[4492, 4439, 507531, 2732169, 3519024, 3962987, 853941, 2326799, 2326787]",cpb new dvd drive for hp g62 599062 001 z cdw internal use service pts cdwg com,,82 78,0
1055,"[3639429, 3639430, 3614116, 498375, 312617, 4747653, 3614603, 7512148, 5857840]",nike f c zoom mercurial xi fk rosso university scarpe uomo 3rd oct,,,"[2576418, 18401829, 3087281, 2076724, 2635791, 2467627, 15295479, 45650, 688148]",nike free trainer 3 0 v4 noir rouge volt chaussures homme,,,0
1056,"[476543, 1633574, 72597546, 527998, 3675506, 2168008, 1265432, 3106145, 2400623]",nike f c zoom mercurial xi fk rot herren trainingsschuhe,,,"[12069787, 108006, 2308427, 17466708, 16864722, 1748698, 3983338, 3546127, 7824622]",nike zoom speed tr3 noir blanc chaussures pour homme,,,0
1057,"[3068742, 1153528, 3204762, 1019607, 19999941, 220299, 209413, 5696658, 5572968]",nike f c zoom mercurial xi fk rojo cr7 zapatillas deportivas,,,"[52303067, 52302975, 52303081, 52302954, 52303186, 52303013, 50412595, 52303131, 52303000]",nike mercurial vapor xi fg negro rosa botas de futbol terrenos firmes,,,0
1058,"[16232079, 7959867, 12755099, 10540954, 7365701, 465053, 55520012, 20128284, 7824614]",asics gel noosa tri 11 herren laufschuhe farbe vielfarbig t626n 9601 der online shop f r deine sportbekleidung,asics,,"[153362, 4004110, 4004122, 4004126, 736887, 1853367, 847, 14664875, 2631425]",gel resolution 7 men scarpe da tennis uomo asics,,,0
1059,"[16232079, 7365701, 7959867, 10540954, 465053, 12755099, 20128284, 55520012, 2176438]",asics gel noosa tri 11 czarny 379 99 pln running t626n9601 up8 com,asics,,"[23542316, 11592, 7562188, 7562179, 2302339, 826340, 108067, 624571, 7562167]",asics gel sonoma 3 g tx t727n 9099,asics,,0
1060,"[6990294, 105674, 3227993, 917206, 3087281, 2176438, 5437017, 5437015, 5437014]",gel noosa tri 11 men fast running asics,,,"[64582826, 60065815, 1932836, 590023, 4976398, 21711226, 64710476, 2710477, 28541555]",gel resolution 7 voor heren men tennisschoenen asics,,,0
1061,"[29566195, 647054, 129068, 2870245, 1130577, 5372, 4867643, 2887242, 1129480]",basketball shoes air jordan vi retro prm heriress sale shop basketmania,,,"[27964392, 11723029, 1103927, 521305, 2889334, 3220782, 5069753]",air jordan 6 chameleon 907961 015,,,0
1062,"[29566195, 647054, 129068, 2870245, 1130577, 5372, 4867643, 2887242, 1129480]",basketball shoes air jordan vi retro prm heriress sale shop basketmania,,,"[58815128, 31391, 1636966, 3298352, 1271179, 3233998, 4728320, 12106680, 24283755]",2017 cheap all star air jordan 6 chameleon for sale jordans,,,0
1063,"[29566195, 647054, 129068, 2870245, 1130577, 5372, 4867643, 2887242, 1129480]",basketball shoes air jordan vi retro prm heriress sale shop basketmania,,,"[29566195, 647054, 129068, 2870245, 1130577, 5372, 4867643, 2887242, 1129480]",basketball shoes air jordan v retro gs shop basketmania,,,0
1064,"[3685900, 40943, 3633433, 7877492, 3837852, 244442, 101045, 39426, 4451420]",asics hyper ld 5 zapatillas con clavos color azul g404y 4399 equipamiento deportivo y casual,asics,,"[17493275, 2628556, 157064, 1069901, 12257149, 794586, 5187395, 4140943, 586918]",puma evospeed 4 5 tricks fg pink glo safety yellow black mens shoes firm ground,,,0
1065,"[3685900, 40943, 3633433, 7877492, 3837852, 244442, 101045, 39426, 4451420]",asics hyper ld 5 zapatillas con clavos color azul g404y 4399 equipamiento deportivo y casual,asics,,"[950355, 6517221, 6517201, 54807265, 48741202, 27062798, 13748927, 2358400, 909574]",nike tiempo legacy ic fu ballschuhe halle farbe hellblau 631522 418 der online shop f r deine sportbekleidung,nike,,0
1066,"[3685900, 40943, 3633433, 7877492, 3837852, 244442, 101045, 39426, 4451420]",asics hyper ld 5 zapatillas con clavos color azul g404y 4399 equipamiento deportivo y casual,asics,,"[483915, 165023, 60517466, 5262520, 3341498, 7034804, 1990127, 90007, 448969]",nike tiempo legacy ic botas f tbol sin tacos color azul claro 631522 418 equipamiento deportivo y casual,nike,,0
1067,"[1989695, 19369314, 27230377, 3331738, 1331243, 532200, 11321408, 7752936, 3851971]",nike tiempo mystic v fg platino puro nero arancione hyper scarpe uomo terreni compatti,,,"[15007953, 476543, 23639899, 7927453, 7927450, 7927449, 7927444, 7927441, 4026976]",nike mercurial victory v fg volt hiper rosa negro botas de futbol 651632 760,,,0
1068,"[42906243, 3276915, 844607, 532200, 50682532, 19369314, 3331738, 9198364, 15634798]",nike tiempo mystic v fg pure platinum black hyper orange mens soccer shoes firm ground,,,"[15007953, 476543, 23639899, 7927453, 7927450, 7927449, 7927444, 7927441, 4026976]",nike mercurial victory v fg volt hiper rosa negro botas de futbol 651632 760,,,0
